JAPANESE WORD,JAPANESE WORD WITH KANA,ENGLISH WORD,PART OF WORD,SYNONYM,PHONETICS,SENTENCE ID,JAPANESE SENTENCE,JAPANESE HIGHLIGHT,JAPANESE SENTENCE WITH KANA,ENGLISH SENTENCE,ENGLISH SENTENCE WITH CLOZE,ENGLISH AUDIO FILE
詳細,詳細(しょうさい),details,Noun,,dɪˈteɪlz,023,詳細はdocsを見てください。,詳細,詳細(しょうさい)はdocsを見(み)てください。,Please check the docs for details.,Please check the docs for d{{etails}}.,
詳しく,詳(くわ)しく,in detail,Adverb,,ɪn dɪˈteɪl,024,どんなインシデントだったか詳しく教えてもらえますか。,詳しく,どんなインシデントだったか詳(くわ)しく教(おし)えてもらえますか。,Could you tell me about the incident in detail?,Could you tell me about the incident i{{n}} {{detail}}?,
方針,方針(ほうしん),policy,Noun,,ˈpɑləsi,025,まだ会社の方針が決まってない。,方針,まだ会社(かいしゃ)の方針(ほうしん)が決(き)まってない。,The company policy has not been decided yet.,The company p{{olicy}} has not been decided yet.,
補足する,補足(ほそく)する,add,Verb,,æd,026,ケンさんの話への補足なんですけど、、、,補足,ケンさんの話(はなし)への補足(ほそく)なんですけど、、、,Let me add something to what Ken said.,Let me a{{dd}} something to what Ken said.,
効果的,効果的(こうかてき),effective,Adjective,,ɪˈfɛktɪv,027,このやり方が効果的だと思います。,効果的だ,このやり方(かた)が効果的(こうかてき)だと思(おも)います。,I think this way is effective.,I think this way is e{{ffective}}.,
達成する,達成(たっせい)する,achieve,Verb,,əˈʧiv,028,先週、OKRを達成しました。,達成し,先週(せんしゅう)、OKRを達成(たっせい)しました。,We achieved our OKR last week.,We a{{chieved}} our OKR last week.,
報告する,報告(ほうこく)する,report,Verb,,rɪˈpɔrt,029,プロジェクトについて報告します。,報告し,プロジェクトについて報告(ほうこく)します。,I will report on the project.,I will r{{eport}} on the project.,
議論する,議論(ぎろん)する,discuss,Verb,,dɪˈskʌs,030,それはEMが議論しているところです。,議論し,それはEMが議論(ぎろん)しているところです。,EMs are discussing it now.,EMs are d{{iscussing}} it now.,
不具合,不具合(ふぐあい),defect,Noun,bug,ˈdifɛkt,031,ちょっと不具合があるので、今日中に直します。,不具合,ちょっと不具合(ふぐあい)があるので、今日中(きょうじゅう)に直(なお)します。,"There are some defects, so I'll fix it by the end of the day.","There are some d{{efects}}, so I'll fix it by the end of the day.",
順調に進む,順調(じゅんちょう)に進(すす)む,work well,Verb,,wɜrk wɛl,032,これは、順調に進んでいます。,順調に進ん,これは、順調(じゅんちょう)に進(すす)んでいます。,This is working well.,This is w{{orking}} w{{ell}}.,
量が多い,量(りょう)が多い,many,Adjective,,ˈmɛni,033,タスクの量が多すぎます。,量,タスクの量(りょう)が多(おお)すぎます。,There are too many tasks.,There are too m{{any}} tasks.,
具体的に,具体的(ぐたいてき)に,concretely,Adverb,,ˈkɑnˌkritli,034,具体的にどんなインシデントでしたか。,具体的に,具体的(ぐたいてき)にどんなインシデントでしたか。,Could you explain the incident more concretely?,Could you explain the incident more c{{oncretely}}?,
状況,状況(じょうきょう),situation,Noun,,ˌsɪʧuˈeɪʃən,035,QAのリソースが厳しい状況です。,状況,QAのリソースが厳(きび)しい状況(じょうきょう)です。,We're in a tough situation in terms of QA resources.,We're in a tough s{{ituation}} in terms of QA resources.,
現状,現状(げんじょう),present situation,Noun,,ˈprɛzənt ˌsɪʧuˈeɪʃən,036,現状を説明します。,現状,現状(げんじょう)を説明(せつめい)します。,I'll explain about the present situation.,I'll explain about the p{{resent}} s{{ituation}}.,
進捗確認,進捗確認(しんちょくかくにん),progress check,Noun,,ˈprɑˌgrɛs ʧɛk,037,まずは、進捗確認をしましょう。,進捗確認,まずは、進捗確認(しんちょくかくにん)をしましょう。,Let's start with a progress check.,Let's start with a p{{rogress}} c{{heck}}.,
優先順位,優先順位(ゆうせんじゅんい),priority,Noun,,praɪˈɔrəti,038,優先順位を決めたほうがいいと思います。,優先順位,優先順位(ゆうせんじゅんい)を決(き)めたほうがいいと思(おも)います。,I think we should decide the priority.,I think we should decide the p{{riority}}.,
残って,残(のこ)って,left,Adjective,,lɛft,039,残っているチケットはありますか。,残っ,残(のこ)っているチケットはありますか。,Are there any tickets left?,Are there any tickets l{{eft}}?,
着手する,着手(ちゃくしゅ)する,initiate,Verb,,ɪˈnɪʃiɪt,040,それって、もう着手してますか？,着手し,それって、もう着手(ちゃくしゅ)してますか？,"Have you already initiated it? ","Have you already i{{nitiated}} it? ",
調整する,調整(ちょうせい)する,adjust,Verb,,əˈʤʌst,041,最近忙しすぎるので、タスクの量を調整したほうがいいいと思っています。,調整し,最近(さいきん)忙(いそが)しすぎるので、タスクの量(りょう)を調整(ちょうせい)したほうがいいいと思(おも)っています。,I'm thinking I should adjust my workload because I've been too busy these days.,I'm thinking I should a{{djust}} my workload because I've been too busy these days.,
認識が合う,認識(にんしき)が合う,on the same page,Adjective,,ɑn ðə seɪm peɪʤ,042,全員で認識を合わせたいです。,認識,全員(ぜんいん)で認識(にんしき)を合(あ)わせたいです。,I'd like to make sure everyone's on the same page.,I'd like to make sure everyone's o{{n}} the s{{ame}} {{page}}.,
認識のずれ,認識のずれ,misunderstanding,Noun,,ˌmɪsəndərˈstændɪŋ,043,認識がずれてないか確認したいです。,認識がずれ,認識(にんしき)がずれてないか確認(かくにん)したいです。,I'd like to make sure there's no misunderstanding between us.,I'd like to make sure there's no m{{isunderstanding}} between us.,
変更する,変更(へんこう)する,change,Verb,,ʧeɪnʤ,044,スケジュールが変更しています。,変更し,スケジュールが変更(へんこう)しています。,The schedule has been changed.,The schedule has been c{{hanged}}.,
開始する,開始(かいし)する,start,Verb,,stɑrt,045,来週からキャンペーンが開始します。,開始し,来週(らいしゅう)からキャンペーンが開始(かいし)します。,We will start a campaign next week.,We will s{{tart}} a campaign next week.,
前倒しする,前倒(まえだお)しする,move up,Verb,,muv ʌp,046,このプロジェクトは、前倒しで進めましょう,前倒し,このプロジェクトは、前倒(まえだお)しで進(す)めましょう。,Let's move up this project. (Ex: from next qtr to this qtr),Let's m{{ove}} {{up}} this project. (Ex: from next qtr to this qtr),
以降,以降(いこう),sometime after,Noun,,ˈsʌmˌtaɪm ˈæftər,047,コードレビューは、来週以降の予定です,以降,コードレビューは、来週(らいしゅう)以降(いこう)の予定(よてい)です。,We're planning to do a code review sometime after next week.,We're planning to do a code review s{{ometime}} {{after}} next week.,